{
  "schema_version": "4.0",
  "task_id": "seven_scene_symbol_value_finetune_eval_v13",
  "family": "finetune_eval",
  "dataset_id": "physics_video_seven_scene_v13",
  "dataset_view": "view_a",
  "selection": {
    "scene_ids": [
      "pendulum",
      "collision_1d",
      "inclined_plane_slide",
      "uniform_circular_motion",
      "parabolic_motion",
      "push_bottle",
      "vertical_spring_oscillator"
    ],
    "test_regimes": ["id"]
  },
  "seeds": {
    "training": [42],
    "inference": [42]
  },
  "evaluation": {
    "protocol": "scene_default_v10_seven_scene_unscored",
    "reporting": {
      "primary_score": "overall_test",
      "breakdowns": [],
      "minimum_subgroup_jobs": 5
    }
  }
}
