{
  "schema_version": "4.0",
  "task_id": "symbol_value_smoke_circular_v13",
  "family": "finetune_eval",
  "dataset_id": "physics_video_seven_scene_v13",
  "dataset_view": "view_a",
  "selection": {
    "scene_ids": ["uniform_circular_motion"],
    "test_regimes": ["id"]
  },
  "seeds": {"training": [42], "inference": [42]},
  "evaluation": {
    "protocol": "scene_default_v10",
    "reporting": {
      "primary_score": "overall_test",
      "breakdowns": [],
      "minimum_subgroup_jobs": 5
    }
  }
}
